{
  "model_name": "MusicNet-Attn-Note-Smooth-V1.0.2-SingleGPU",
  "model_type": null,
  "model_params": 7920343,
  "output_classes": 23,
  "label_type": "multi_instrument_note",
  "timesteps": 128,
  "frame_threshold": 0.5,
  "instrument_threshold": 1.1,
  "onset_threshold": 6,
  "duration_threshold": 0,
  "feature_type": "CFP",
  "input_channels": [
    1,
    3
  ],
  "training_settings": {
    "dataset": null,
    "epochs": null,
    "steps": null,
    "train_batch_size": null,
    "val_batch_size": null,
    "loss_function": null,
    "early_stop": null
  },
  "description": "Information about this model\n            Model name: MusicNet-Attn-Note-Smooth-V1.0.2-SingleGPU\n            Input feature type: CFP\n            Input channels: [1, 3]\n            Timesteps: 128\n            Label type: multi_instrument_note\n            Total parameters: 7920343\n            Thresholds:\n                Instrument: 1.1\n                Frame: 0.5\n                Onset: 6\n                Duration: 0\n            Training settings:\n                Previously trained on None\n                Maximum epochs: None\n                Steps per epoch: None\n                Training batch size: None\n                Validation batch size: None\n                Loss function type: None\n                Early stopping: None\n        "
}